{
  "storeVersion": 1,
  "licence": "MIT",
  "homepage": "https://github.com/JaminB/melange-plugins/tree/main/plugins/kindjal",
  "categories": [
    "weapons",
    "gameplay"
  ],
  "gameBuilds": [
    "1077"
  ],
  "screenshots": [],
  "versions": [
    {
      "version": "1.3.1",
      "released": "2026-10-18",
      "melange": ">=0.9.0",
      "kind": "content",
      "permissions": {
        "unsafe": false,
        "filesystem": "none"
      },
      "dependencies": [],
      "conflicts": [],
      "url": "https://github.com/JaminB/melange-plugins/releases/download/kindjal-v1.3.1/kindjal-1.3.1.zip",
      "sha256": "98e3dff95d7c50aaca2e59b3244558ef823337785274a7d7fac383024cab2e97",
      "size": 5922400,
      "unpackedSize": 16936513,
      "files": 131,
      "changelog": "- The Buddy Bomb's panel and HUD icon is now his face: a black curly labradoodle with floppy ears, big brown eyes and his tongue out, with a lit stick of dynamite under his collar.\n- He is a longer dog: his body is stretched by about a third, and his legs and walk are unchanged.\n- His dynamite is a whole vest now: rows of bright red sticks round his back and down both flanks, taped, with a timer and a red light on top and a lit fuse, so it reads from the side at the game's camera distance.\n- A few little pink and red hearts float up when he is set down.\n- More blood when he goes off: a red mist, a wider and denser spray with heavy gouts in it, and a pool of blood on the ground under the blast. With Bloodsand on, the burst is a little smaller, as Bloodsand gibs the worms caught in it."
    },
    {
      "version": "1.3.0",
      "released": "2026-10-18",
      "melange": ">=0.9.0",
      "kind": "content",
      "permissions": {
        "unsafe": false,
        "filesystem": "none"
      },
      "dependencies": [],
      "conflicts": [],
      "url": "https://github.com/JaminB/melange-plugins/releases/download/kindjal-v1.3.0/kindjal-1.3.0.zip",
      "sha256": "cd5d1507ad22bedf110c3405b7ca6f5ea9279ebaed0951c03466af5113e00a39",
      "size": 5923914,
      "unpackedSize": 16933695,
      "files": 130,
      "changelog": "- The Rabid Flock (the Sheep's slot) is now the Buddy Bomb: a black curly labradoodle with three sticks of dynamite on his back, with his own model, panel and HUD icon. He walks and hops like the sheep did and goes off on a second press of fire or when the 30 s fuse runs out.\n- A bigger blast than the sheep: 115 damage over 160, crater 130, knockback 0.50 over 175, with the large explosion effect (was 95 over 130, crater 105, 0.39 over 145).\n- The sheep's baa is gone from the Buddy Bomb. He barks while he walks, yelps just before the fuse runs out (or at the blast when set off early), falls quiet the moment he hits water, and leaves tufts of fur and a spray of blood where he went off.\n- The Plague Ram and Dead Star keep the rabid sheep they hold before they take off, and keep their own sounds.\n- He does not go off when he touches a worm: the game's sheep hops over worms in its way, and the setting that changes that cannot be written by a plugin yet."
    },
    {
      "version": "1.2.0",
      "released": "2026-10-17",
      "melange": ">=0.9.0",
      "kind": "content",
      "permissions": {
        "unsafe": false,
        "filesystem": "none"
      },
      "dependencies": [],
      "conflicts": [],
      "url": "https://github.com/JaminB/melange-plugins/releases/download/kindjal-v1.2.0/kindjal-1.2.0.zip",
      "sha256": "5352e8d48812af6a1e761dc41ce22edfe188dd2604e17d5a9462f7bfd6d0e7a5",
      "size": 5768193,
      "unpackedSize": 16661271,
      "files": 126,
      "changelog": "- The acid eats Sunstone's human skin: with Sunstone 2.2's Worm skin on a tone, the acid finds the skin by the mark\n  Sunstone leaves in the scene instead of by the game's peach colour (which a human tone no longer has), and lights itself\n  by that worm's skin brightness, so it looks the same on a dark skin as on the peach. It still leaves blood, wounds and\n  guts alone. With Sunstone 2.2 the game's peach is found by the mark too, so the acid also shows under Lunar's purple\n  light. The colour test always counts too, so should Sunstone's shader not run the peach is still found. On a dark tone\n  the acid covers more of the skin under it, so it reads as the poison's green, not a faint olive stain. Nothing changes\n  without Sunstone 2.2.\n- With Sunstone 2.2, the acid also shows on a worm seen through a ledge (the game shows the worm whose turn it is through\n  what stands in front of it), a little fainter, instead of stopping in a hard line at the ledge's edge.\n- The preview event (`mod.kindjal.preview`, `what = \"acid\"`) takes `target = \"active\"` to coat the active worm."
    },
    {
      "version": "1.1.0",
      "released": "2026-10-15",
      "melange": ">=0.9.0",
      "kind": "content",
      "permissions": {
        "unsafe": false,
        "filesystem": "none"
      },
      "dependencies": [],
      "conflicts": [],
      "url": "https://github.com/JaminB/melange-plugins/releases/download/kindjal-v1.1.0/kindjal-1.1.0.zip",
      "sha256": "21e5d99aef158efdedcbc88a282427f851ab316434d0793c0099641ebce695b6",
      "size": 5766104,
      "unpackedSize": 16654590,
      "files": 126,
      "changelog": "- Knockback brought back to near the game's own: every weapon now throws worms about 1.2 times as hard as vanilla, over\n  about 1.1 times the reach, instead of two to three times as hard (the Ripper 0.64 to 0.35, the Gorger 1.80 to 0.72,\n  the Earthquake Ass 1.30 to 0.56, the Crucible 1.35 to 0.62). Damage, blast radius and craters are unchanged.\n- The Railspike, Knifeman and Rust Canister, which have no knockback in the game, get a small one.\n- Knockback is tunable: `KNOCKBACK`, `REACH` and `MELEE` at the top of `mod/sim/main.lua` scale every knockback and\n  reach, the three new weapons included. They live in the sim script, not on the Mods page, because the match cannot\n  read Mods-page settings; the file is content-hashed, so every online player must have the same values.\n- Two optional add-on plugins pick a different knockback power: Kindjal Heavy (about 1.7 times vanilla) and Kindjal\n  Brutal (the 1.0.0 numbers). Enable one; every online player must enable the same one.\n- Weapon descriptions no longer promise worms thrown across the map."
    },
    {
      "version": "1.0.0",
      "released": "2026-10-10",
      "melange": ">=0.9.0",
      "kind": "content",
      "permissions": {
        "unsafe": false,
        "filesystem": "none"
      },
      "dependencies": [],
      "conflicts": [],
      "url": "https://github.com/JaminB/melange-plugins/releases/download/kindjal-v1.0.0/kindjal-1.0.0.zip",
      "sha256": "823a350e59cbd9f47998f427a143b9b36045a0f8176f601a15b18ee9babcc09c",
      "size": 5764795,
      "unpackedSize": 16650889,
      "files": 126,
      "changelog": "First release. Needs Melange 0.9.0 or later.\n\n- Every vanilla weapon re-statted darker at match start (damage, blast radius, crater, knockback) and renamed: Nail\n  Bat, Hellfist, Shiv, Railspike, Ripper, Pipe Bomb, Blast Keg, Profane Grenade, Plantain Hell, Nail Cluster, Bear Trap,\n  Harpoon, Carpet Bombing, Carrion Drop, Earthquake Ass, Rabid Flock, Plague Ram, Hangwoman, Knifeman, Gorger, Dead\n  Star, Slug Gun, Elephant Gun, Gibbet Turret, Plague Arrow, Rust Canister.\n- Three new weapons: Acid Spitter, Acid Flask and Crucible, with their own icons and models; every renamed weapon\n  gets its own panel and HUD icon.\n- Models: every renamed weapon has its own held and/or projectile model (37 mesh banks), and the Airstrike and Super\n  Airstrike helicopters are replaced by a black and a bone-white gunship. 19 banks are static meshes built from\n  scratch; 18 are clones of vanilla skinned meshes that keep the game's rig, skin weights, animation clips and UV layout\n  (see \"What is derived from the game\" in the README). Seen in play so far: the Nail Bat, Acid Flask and Crucible in hand.\n- Acid that clings to a worm's skin, bubbles and smokes; acid puddles; melee impact sparks and hit-flash; new sounds.\n- Content mod: every player in an online match needs the same version."
    }
  ]
}
