{
  "storeVersion": 1,
  "licence": "MIT",
  "homepage": "https://github.com/JaminB/melange-plugins/tree/main/plugins/holo",
  "categories": [
    "interface",
    "audio"
  ],
  "gameBuilds": [
    "1077"
  ],
  "screenshots": [
    {
      "file": "1.jpg",
      "caption": "Your turn: the player sits in the corner, below the wind and the health badge"
    },
    {
      "file": "2.jpg",
      "caption": "Someone else's turn online: the player grows into a half-screen panel"
    },
    {
      "file": "3.jpg",
      "caption": "Control bar and menu: skip, speed, audio track, quality, queue"
    },
    {
      "file": "4.jpg",
      "caption": "Set up the party from the menus: paste YouTube or magnet links into the queue"
    },
    {
      "file": "5.jpg",
      "caption": "Torrents with several videos: pick the one to play"
    },
    {
      "file": "6.jpg",
      "caption": "Minimised to a pill, one key away"
    }
  ],
  "versions": [
    {
      "version": "1.0.0",
      "released": "2026-10-26",
      "melange": ">=0.12.0",
      "kind": "client-only",
      "permissions": {
        "unsafe": false,
        "filesystem": "none"
      },
      "dependencies": [],
      "conflicts": [],
      "url": "https://github.com/JaminB/melange-plugins/releases/download/holo-v1.0.0/holo-1.0.0.zip",
      "sha256": "bc3607b61a7ecb138af645e08af84d6f3b34b1aa10b041c51b401624156c31fe",
      "size": 1350963,
      "unpackedSize": 1568134,
      "files": 15,
      "changelog": "First release. Needs Melange 0.12.0 or later.\n\n- Watch parties: the lobby host plays YouTube videos, playlists or magnet links in a themed in-game player, synced for every player who has Holo.\n- Corner player while you play, half-screen player during other players' turns (online), pill when minimised.\n- Setup panel (F6): add links, queue with reorder and remove, torrent file picker, player list with pack and ping status.\n- Game music is silenced during a party (setting).\n- Media pack and yt-dlp download once, only after you click Download.\n- Torrents share your IP address with the swarm."
    }
  ]
}
