{
  "storeVersion": 1,
  "licence": "MIT",
  "homepage": "https://github.com/JaminB/melange-plugins/tree/main/plugins/kanly",
  "categories": [
    "gameplay"
  ],
  "gameBuilds": [
    "1077"
  ],
  "screenshots": [],
  "versions": [
    {
      "version": "1.3.0",
      "released": "2026-10-15",
      "melange": ">=0.8.0",
      "kind": "client-only",
      "permissions": {
        "unsafe": false,
        "filesystem": "none"
      },
      "dependencies": [],
      "conflicts": [],
      "url": "https://github.com/JaminB/melange-plugins/releases/download/kanly-v1.3.0/kanly-1.3.0.zip",
      "sha256": "d15ed0858392c52a3347be2359cf240dbd8ebba2533044a16a99f71788300190",
      "size": 16317720,
      "unpackedSize": 16414850,
      "files": 38,
      "changelog": "Weapons now unlock as the match progresses and run out after a few uses, in both styles.\n\n- Kanly: weapons have an unlock turn (Delay) in four tiers, start, turn 1, turn 2 and turn 3. The match opens with basics\n  and utilities; mid-tier weapons come at turn 1, heavy ones at turn 2, and the super weapons (Concrete Donkey, Super\n  Airstrike, Fatkins, Starburst, Flood, Alien Abduction, Weapon Factory weapon) at turn 3.\n- Ammo is cut hard: basics 3 to 4, utilities 2 to 3, mid tier 2 (power-ups 1), heavy and super weapons 1. Nothing is\n  unlimited and crates stay on.\n- The 15 mystery crate entries now get 1 ammo and unlock at turn 1.\n- Kanly Melee: the same tiers for the allowed weapons (no super tier), same bans.\n- Netplay: the host and every peer need Kanly 1.3.0."
    },
    {
      "version": "1.2.0",
      "released": "2026-10-10",
      "melange": ">=0.8.0",
      "kind": "client-only",
      "permissions": {
        "unsafe": false,
        "filesystem": "none"
      },
      "dependencies": [],
      "conflicts": [],
      "url": "https://github.com/JaminB/melange-plugins/releases/download/kanly-v1.2.0/kanly-1.2.0.zip",
      "sha256": "c7c745e879a0ef16cd1b4ba523a825684203be5c34596d3a0241e7e586c5bb97",
      "size": 16317686,
      "unpackedSize": 16414869,
      "files": 38,
      "changelog": "Adds a second game style, Kanly Melee.\n\n- Kanly Melee: the Kanly timings (five minute round, then fast-rising water) with close-range weapons only. Bazooka,\n  Homing Missile, Shotgun, Sniper Rifle, Poison Arrow, Sentry Gun, No More Nails, Bubble Trouble, Starburst, Super\n  Sheep, Weapon Factory weapon, both airstrikes, Concrete Donkey, Fatkins, Alien Abduction, Scouser, Flood and Crate\n  Shower are removed from the loadout and from crates. Fire Punch and Prod get 5 uses each (2 in Kanly).\n- Fix to the docs: Kanly's 15 mystery crate entries get 10 ammo and no delay, they are not left as in Standard.\n- Netplay: the host and every peer need Kanly 1.2.0, because the game style list positions shift with the new style."
    },
    {
      "version": "1.1.0",
      "released": "2026-10-09",
      "melange": ">=0.8.0",
      "kind": "client-only",
      "permissions": {
        "unsafe": false,
        "filesystem": "none"
      },
      "dependencies": [],
      "conflicts": [],
      "url": "https://github.com/JaminB/melange-plugins/releases/download/kanly-v1.1.0/kanly-1.1.0.zip",
      "sha256": "b71a7ea733673c709584dc2c8f1e8226cf4bbc3cfe4ea6b73995af31a6976d0a",
      "size": 16316968,
      "unpackedSize": 16412374,
      "files": 37,
      "changelog": "Adds control fixes and control hints. Needs Melange 0.8.0 or later.\n\n- Camera and aim: choose the 3rd-person camera Y direction (game, standard or inverted; standard is the new default),\n  the first-person aim Y direction, whether the camera invert also applies in Blimp view, and a camera and an aim\n  mouse sensitivity.\n- Control hints: short, faded key and mouse prompts at the bottom centre on your own turn (off, learning or always).\n  In learning mode a prompt disappears after you have used it three times.\n- Controls legend: press F1 (or Ctrl+H, a setting) during a match for the full control list.\n- A one-time note on the first match about the camera Y default."
    },
    {
      "version": "1.0.2",
      "released": "2026-10-09",
      "melange": ">=0.5.0",
      "kind": "client-only",
      "permissions": {
        "unsafe": false,
        "filesystem": "none"
      },
      "dependencies": [],
      "conflicts": [],
      "url": "https://github.com/JaminB/melange-plugins/releases/download/kanly-v1.0.2/kanly-1.0.2.zip",
      "sha256": "bbec0aa997b8ec160e6a91ae66cae89c64739e223ba20bac9c6b75bc2fefd7ef",
      "size": 16262862,
      "unpackedSize": 16342536,
      "files": 11,
      "changelog": "Runs on Melange 0.7 and every later version: the plugin no longer names an upper Melange version, so a new\nMelange release no longer moves it to `Mods\\.incompatible`. No other change."
    },
    {
      "version": "1.0.1",
      "released": "2026-10-09",
      "melange": ">=0.5.0 <0.7.0",
      "kind": "client-only",
      "permissions": {
        "unsafe": false,
        "filesystem": "none"
      },
      "dependencies": [],
      "conflicts": [],
      "url": "https://github.com/JaminB/melange-plugins/releases/download/kanly-v1.0.1/kanly-1.0.1.zip",
      "sha256": "e69ac26e2dcd95bc549c94c21043640395364bdc85515be4f7cfced97fbf81a5",
      "size": 16262870,
      "unpackedSize": 16342543,
      "files": 11,
      "changelog": "Runs on Melange 0.6. No other change."
    },
    {
      "version": "1.0.0",
      "released": "2026-10-06",
      "melange": ">=0.5.0 <0.6.0",
      "kind": "client-only",
      "permissions": {
        "unsafe": false,
        "filesystem": "none"
      },
      "dependencies": [],
      "conflicts": [],
      "url": "https://github.com/JaminB/melange-plugins/releases/download/kanly-v1.0.0/kanly-1.0.0.zip",
      "sha256": "aff78452dbc136eda65a39d1c79b15476ac09f6eedef6939f5f1f0cc4b5cd285",
      "size": 16262869,
      "unpackedSize": 16342543,
      "files": 11,
      "changelog": "First release. Adds the Kanly game style and four Weapon Factory presets (Kanly Red, Blue, Green and Yellow) to the\nvanilla menus, and replaces the sudden-death music with four Kanly tracks. Needs Melange 0.5.0 or later."
    }
  ]
}
